{
  "schema_version": 1,
  "register_id": "ATIS-STAGE3-SUCCESSOR-EVIDENCE-REGISTER-001",
  "contract_id": "ATIS_STAGE3_SUCCESSOR_EVIDENCE_AND_RECOVERY_POLICY_V1",
  "register_role": "BOUNDED_SUCCESSOR_TRANSITIONS_NOT_COMPLETE_SOURCE_REGISTRY",
  "records": [
    {
      "record_id": "SE-CAND-001",
      "record_type": "CANDIDATE_SUCCESSOR",
      "governing_stage": "STAGE3",
      "governing_rb": "RB1",
      "governing_slice": "ATIS-S3-RB1-S1",
      "predecessor_evidence": [
        "docs/stage3/stage3-specification.json",
        "docs/programme/programme-control.json"
      ],
      "predecessor_commit": "b5782f41bf2e687d9ee6ffe55c62ca2e9daa28b5",
      "predecessor_tree": "d8c90c91cc24f9b581ee4321389767d53fae5c3e",
      "authorization_references": [
        "PC-DEC-005"
      ],
      "path_transitions": [
        {
          "path": "src/automated_trading_bot/domain/decision.py",
          "predecessor_blob": "ef9f26caac51a9dbb50161699a7f3d71840efc10",
          "successor_candidate_blob": "23dd735bf239e529a9863ee66a044ec12bd40712",
          "role": "IMPLEMENTATION",
          "requirement_references": [
            "ATIS_RB1_IDENTITY_AND_REFERENCE_MODEL_V1",
            "ATIS_RB1_SLICE1_IMPLEMENTATION_CONTRACT_V1",
            "S3-REQ-001",
            "S3-REQ-002",
            "S3-REQ-003"
          ]
        },
        {
          "path": "src/automated_trading_bot/domain/identifiers.py",
          "predecessor_blob": "97f27cb0fa456f58f54a5a3f5e9093a2ac70152c",
          "successor_candidate_blob": "e03e3bc2b934bd639477dc717fd47af4842339f7",
          "role": "IMPLEMENTATION",
          "requirement_references": [
            "ATIS_RB1_IDENTITY_AND_REFERENCE_MODEL_V1",
            "ATIS_RB1_SLICE1_IMPLEMENTATION_CONTRACT_V1",
            "S3-REQ-001",
            "S3-REQ-002",
            "S3-REQ-003"
          ]
        },
        {
          "path": "src/automated_trading_bot/instruments/__init__.py",
          "predecessor_blob": "ABSENT",
          "successor_candidate_blob": "1f1ee477e4d682d76c8a568fcccddcf9c6e29faa",
          "role": "IMPLEMENTATION",
          "requirement_references": [
            "ATIS_RB1_IDENTITY_AND_REFERENCE_MODEL_V1",
            "ATIS_RB1_SLICE1_IMPLEMENTATION_CONTRACT_V1",
            "S3-REQ-001",
            "S3-REQ-002",
            "S3-REQ-003",
            "S3-REQ-004_FOUNDATION_ONLY"
          ]
        },
        {
          "path": "src/automated_trading_bot/instruments/model.py",
          "predecessor_blob": "ABSENT",
          "successor_candidate_blob": "348f4ce64a32a5a43445011a4a0028a875f18170",
          "role": "IMPLEMENTATION",
          "requirement_references": [
            "ATIS_RB1_IDENTITY_AND_REFERENCE_MODEL_V1",
            "ATIS_RB1_SLICE1_IMPLEMENTATION_CONTRACT_V1",
            "S3-REQ-001",
            "S3-REQ-002",
            "S3-REQ-003",
            "S3-REQ-004_FOUNDATION_ONLY"
          ]
        },
        {
          "path": "tests/test_decision.py",
          "predecessor_blob": "3a7bb65314c05fbcfb99d8641f8dac72eb4f6f52",
          "successor_candidate_blob": "a43a21de51e7ef3c2a032e87be0a907b41f8fae3",
          "role": "TEST",
          "requirement_references": [
            "ATIS_RB1_SLICE1_IMPLEMENTATION_CONTRACT_V1",
            "S3-REQ-001",
            "S3-REQ-002",
            "S3-REQ-003"
          ]
        },
        {
          "path": "tests/test_identifiers.py",
          "predecessor_blob": "a71dba9fcd447f82626e75f393395adb866beda4",
          "successor_candidate_blob": "aec0d60d52b3ac9f5698f55153c2d880d6d01bf0",
          "role": "TEST",
          "requirement_references": [
            "ATIS_RB1_SLICE1_IMPLEMENTATION_CONTRACT_V1",
            "S3-REQ-001",
            "S3-REQ-002",
            "S3-REQ-003"
          ]
        },
        {
          "path": "tests/test_instrument_reference_model.py",
          "predecessor_blob": "ABSENT",
          "successor_candidate_blob": "789fc96a11438463ebd8ad15ffce0be75352c2b8",
          "role": "TEST",
          "requirement_references": [
            "ATIS_RB1_SLICE1_IMPLEMENTATION_CONTRACT_V1",
            "S3-REQ-001",
            "S3-REQ-002",
            "S3-REQ-003",
            "S3-REQ-004_FOUNDATION_ONLY"
          ]
        }
      ],
      "transition_reason": "Owner-authorized resumption of the exact preserved ATIS-S3-RB1-S1 candidate against the protected successor-evidence baseline without changing its seven implementation/test blobs.",
      "verification_evidence": [
        "INITIAL_TARGETED_PYTEST_875_OF_875_PASS",
        "INITIAL_FULL_PYTEST_1795_OF_1795_PASS",
        "RUFF_PASS",
        "STRICT_MYPY_47_SOURCE_FILES_PASS",
        "PIP_CHECK_PASS",
        "PIP_AUDIT_NO_KNOWN_VULNERABILITIES",
        "CLOSURE_SECURITY_AND_ARCHITECTURE_65_OF_65_PASS",
        "DRAFT_2020_12_DIGEST_RECOVERY_AUTHORITY_TESTS_PASS"
      ],
      "candidate_state": "VERIFIED_LOCAL_UNPUBLISHED",
      "authority": {
        "granted": [],
        "not_granted": [
          "RB1_IMPLEMENTATION_RESUMPTION",
          "STAGE3_IMPLEMENTATION",
          "SLICE1_CANDIDATE_PUBLICATION",
          "AI_TRADING_AUTHORITY"
        ]
      }
    },
    {
      "record_id": "SE-PUB-001",
      "record_type": "PROTECTED_PUBLICATION",
      "candidate_record_id": "SE-CAND-001",
      "protected_commit": "a72b4ae90c4a02154f7c81cdce010f69996d8e77",
      "protected_tree": "c7b8b30e9cb6deb4a1ac4c89933a8d3ccb79796d",
      "ordered_merge_parents": [
        "b5782f41bf2e687d9ee6ffe55c62ca2e9daa28b5",
        "f983f96c3290620bc45d24af37d53d928b742d8f"
      ],
      "publication_reference": "GitHub pull request 29",
      "protected_path_blobs": [
        {
          "path": "src/automated_trading_bot/domain/decision.py",
          "blob": "23dd735bf239e529a9863ee66a044ec12bd40712"
        },
        {
          "path": "src/automated_trading_bot/domain/identifiers.py",
          "blob": "e03e3bc2b934bd639477dc717fd47af4842339f7"
        },
        {
          "path": "src/automated_trading_bot/instruments/__init__.py",
          "blob": "1f1ee477e4d682d76c8a568fcccddcf9c6e29faa"
        },
        {
          "path": "src/automated_trading_bot/instruments/model.py",
          "blob": "348f4ce64a32a5a43445011a4a0028a875f18170"
        },
        {
          "path": "tests/test_decision.py",
          "blob": "a43a21de51e7ef3c2a032e87be0a907b41f8fae3"
        },
        {
          "path": "tests/test_identifiers.py",
          "blob": "aec0d60d52b3ac9f5698f55153c2d880d6d01bf0"
        },
        {
          "path": "tests/test_instrument_reference_model.py",
          "blob": "789fc96a11438463ebd8ad15ffce0be75352c2b8"
        }
      ],
      "hosted_checks": [
        {
          "name": "m1-engineering-foundation run 36396898552 job 108845332338",
          "conclusion": "SUCCESS"
        }
      ],
      "post_publication_verification": "PASS",
      "open_obligations_preserved": true,
      "authority": {
        "granted": [],
        "not_granted": [
          "RB1_IMPLEMENTATION_RESUMPTION",
          "STAGE3_IMPLEMENTATION",
          "SLICE1_CANDIDATE_PUBLICATION",
          "RB1_IMPLEMENTATION_BEYOND_SLICE1",
          "RB2_IMPLEMENTATION",
          "RB3_IMPLEMENTATION",
          "STAGE4_IMPLEMENTATION",
          "PROVIDER_SELECTION",
          "STORAGE_SELECTION",
          "PAPER_TRADING",
          "LIVE_TRADING",
          "FINANCIAL_EFFECTS",
          "AI_TRADING_AUTHORITY"
        ]
      }
    },
    {
      "record_id": "SE-CAND-002",
      "record_type": "CANDIDATE_SUCCESSOR",
      "governing_stage": "STAGE3",
      "governing_rb": "RB1",
      "governing_slice": "ATIS-S3-RB1-S2",
      "predecessor_evidence": [
        "docs/stage3/stage3-specification.json",
        "docs/programme/programme-control.json",
        "docs/programme/successor-evidence.json"
      ],
      "predecessor_commit": "a7b90227f6817bb7276ec30f90891ca3262d5f03",
      "predecessor_tree": "f973639c1892fdc44b538daa4e3003d4e61a1392",
      "authorization_references": [
        "PC-DEC-007"
      ],
      "path_transitions": [
        {
          "path": "src/automated_trading_bot/instruments/__init__.py",
          "predecessor_blob": "1f1ee477e4d682d76c8a568fcccddcf9c6e29faa",
          "successor_candidate_blob": "9594f8fa3660bd4731c96cc73f60709336eed6c3",
          "role": "IMPLEMENTATION",
          "requirement_references": [
            "S3-REQ-002",
            "S3-REQ-003",
            "S3-REQ-004"
          ]
        },
        {
          "path": "src/automated_trading_bot/instruments/resolution.py",
          "predecessor_blob": "ABSENT",
          "successor_candidate_blob": "95c91ffb35ec44f0819afa6277f2521b1cc04d6d",
          "role": "IMPLEMENTATION",
          "requirement_references": [
            "S3-REQ-002",
            "S3-REQ-003",
            "S3-REQ-004"
          ]
        },
        {
          "path": "tests/test_pit_reference_resolution.py",
          "predecessor_blob": "ABSENT",
          "successor_candidate_blob": "6ea87aa9348443596c08c686474dec5020436d64",
          "role": "TEST",
          "requirement_references": [
            "S3-REQ-002",
            "S3-REQ-003",
            "S3-REQ-004"
          ]
        }
      ],
      "transition_reason": "Owner-authorized bounded ATIS-S3-RB1-S2 deterministic point-in-time reference-resolution implementation, preserving the protected Slice-1 identity and immutable-reference foundation.",
      "verification_evidence": [
        "LOCAL_SLICE2_DIRECT_33_OF_33_PASS",
        "LOCAL_FULL_PYTEST_1830_OF_1830_PASS",
        "LOCAL_RUFF_PASS",
        "LOCAL_STRICT_MYPY_PASS",
        "LOCAL_PIP_CHECK_PASS",
        "LOCAL_PIP_AUDIT_NO_KNOWN_VULNERABILITIES",
        "M1_ENGINEERING_FOUNDATION_PR31_RUN_36425457941_JOB_108938198052_SUCCESS",
        "TRUSTED_M1_EVALUATOR_PR31_RUN_36425457740_JOB_108938197436_ATTEMPT_1_SUCCESS",